"Timestamp","Age","Gender","Degree","SEE","Games","Device","Version","Developer","Time1","ASQ11","ASQ12","ASQ13","Time2","ASQ21","ASQ22","ASQ23","SUS11","SUS12","SUS13","SUS14","SUS15","SUS16","SUS17","SUS18","SUS19","SUS110","Improvements1","Time3","ASQ31","ASQ32","ASQ33","Time4","ASQ41","ASQ42","ASQ43","SUS21","SUS22","SUS23","SUS24","SUS25","SUS26","SUS27","SUS28","SUS29","SUS210","Improvements2"
"2022/05/23 2:45:44 PM GMT+2","16-30 years old","Male","Some High School (Hauptschule/Realschule...)","No","Yes","One+ 10 pro","12","No","3:08","7","5","7","1:07","7","6","7","4","1","4","2","5","1","4","2","5","2","","1:17","7","5","7","0:49","7","7","7","4","1","5","2","4","1","4","1","5","2",""
"2022/05/24 9:49:04 AM GMT+2","16-30 years old","Male","Master's Degree","No","Yes","Xiaomi Mi 10 T Pro","11","No","3:30","5","6","7","02:07","6","7","7","3","3","2","4","5","2","3","3","2","4","Kamera war bei mir invertiert - bei Bewegung im Kamerakreis nach ""oben"" zoomt Kamera heraus - ich finde es intuitiver, wenn die Kamera bei der Bewegung nach ""oben"" hineinzoomen würde.","01:52","7","7","7","01:56","6","6","7","4","2","4","3","5","2","5","2","5","2",""
"2022/05/24 3:37:22 PM GMT+2","16-30 years old","Male","Bachelor's Degree","No","Yes","OnePlus 5T","10","No","6:43 min","5","2","5","57 sec","6","7","6","3","4","2","4","4","2","4","3","3","4","Zoom-Richtung ändern. Finger auseinander zum reinzoomen und umgekehrt.","2:55 min","5","6","6","1:22 min","6","6","6","4","4","3","4","4","2","4","4","3","4",""
"2022/05/25 2:04:59 PM GMT+2","16-30 years old","Male","Master's Degree","No","Yes","Huawei P30","EMUI 12.0.0","No","54","5","5","7","58","7","6","7","3","3","4","4","3","2","4","4","3","2","Improved controls and motions. I felt clumsy controlling the app (for example when zooming in and out)","1:53","6","4","7","3:08","5","3","7","3","2","3","2","4","2","3","4","4","2","controls. Hard to use without a mouse. (only had touchpad)"
"2022/05/25 5:47:20 PM GMT+2","16-30 years old","Male","Bachelor's Degree","Yes","Yes","Samsung Galaxy a52s","12","Yes","1:24","6","6","7","1:21","6","5","7","4","1","5","1","4","2","5","2","5","1","Zooming was a little bit confusing ","0:39","7","7","7","0:23","6","7","7","4","1","4","1","4","1","3","2","5","1",""
"2022/05/26 10:29:40 AM GMT+2","16-30 years old","Male","Bachelor's Degree","Yes","Yes","Fairphone 4 5G","11","Yes","3:53","3","2","4","1:36","4","4","4","2","3","3","2","4","2","2","4","2","2","","01:00","5","5","4","00:46","5","6","5","3","4","3","1","4","3","2","4","3","3","Visible UI elements like in the mobile app, key combinations are hard to remember"
"2022/05/26 2:22:12 PM GMT+2","16-30 years old","Male","Bachelor's Degree","Yes","Yes","OnePlus 6","11","Yes","2:30","6","5","4","0:45","7","7","6","4","2","4","1","5","1","4","1","5","2","The only suggestion I have is inverting the zooming motion, usually in mobile apps ""dragging apart"" means ""zooming in"", while the opposite motion means ""zooming out"".","0:28","7","7","5","0:19","7","7","6","4","1","5","1","5","1","3","1","5","1",""
"2022/05/27 4:40:31 PM GMT+2","16-30 years old","Male","Bachelor's Degree","Yes","Yes","Galaxy S22 Ultra 5G","12","Yes","20","7","7","7","15","7","7","7","5","1","5","1","5","1","5","1","5","2","add a search function; change the zoom directions","53","7","6","7","38","7","7","7","5","1","5","1","5","1","5","1","5","1",""
"2022/05/27 6:09:07 PM GMT+2","16-30 years old","Male","Some High School (Hauptschule/Realschule...)","No","Yes","Samsung S9","10","No","2:29","6","7","6","1:58","7","6","6","3","3","4","4","4","3","5","3","3","3","Bild war falschrum (180Grad)","1:17","6","7","6","0:40","6","7","6","5","1","5","3","4","1","4","1","4","2",""